{
  "schema_version": "2.0.0",
  "bundle_id": "symptom-checker.abdomen.v1",
  "bundle_version": "0.2.0-draft",
  "status": "draft",
  "locale": "fa-IR",
  "created": "2026-10-31",
  "migrated_from": {
    "schema_version": "1.0.0",
    "bundle_id": "symptom-checker.abdomen.v1",
    "bundle_version": "0.2.0-draft",
    "v1_file": "docs/symptom-checker/phase-1/knowledge-bundle.v1.json",
    "evidence_map": "symptom-checker/engine/data/evidence-map.v1.json",
    "tool": "v1_to_v2.py",
    "tool_version": "1.0.0"
  },
  "migration_notes_fa": [
    "مهاجرت قالبی از schema 1.0.0 به 2.0.0 با اسکریپت v1_to_v2.py: شناسهٔ نشانه‌ها پیشوند خوشه گرفت، نگاشت پاسخ→نشانه داخل گزینه‌ها ادغام شد و symptom_links به profile با سطح typical تبدیل شد. هیچ محتوا، متن یا قاعدهٔ بالینی تازه‌ای اضافه نشد."
  ],
  "scope": {
    "cluster": "درد شکم/پهلو در بزرگسالان",
    "first_path": "آپاندیسیت",
    "conditions_in_scope": [
      "app",
      "kidney_stone",
      "kidney_infection",
      "urinary_tract",
      "gastroenteritis"
    ],
    "excluded_by_design": [
      "کودکان زیر ۱۸ سال به‌عنوان پوشش فعال (می‌تواند الگوی نشانه متفاوت داشته باشد)",
      "بارداری و احتمال بارداری (خارج از پوشش این بسته؛ ارجاع به ارزیابی فوری)",
      "وضعیت پس از جراحی شکم"
    ],
    "not_a_diagnosis": "این بسته موضوع‌های مرتبط را بر پایهٔ قواعد مستند پیشنهاد می‌کند؛ تشخیص، معاینه و آزمایش نیست و ادعای دقت بالینی ندارد."
  },
  "answer_states": [
    "yes",
    "no",
    "unknown",
    "not_asked",
    "not_in_profile"
  ],
  "symptom_clusters": [
    {
      "id": "abd",
      "label_fa": "شکم، پهلو و لگن"
    }
  ],
  "sources": [
    {
      "id": "src_profile_app",
      "kind": "internal_profile",
      "title_fa": "شناسنامهٔ آپاندیسیت در مخزن",
      "publisher": "همیار جراحی — دادهٔ قالب",
      "ref": "themes/lax-theme-child/data/disease-profiles.json#app",
      "url": "https://github.com/lakanzino/OR-site/blob/main/themes/lax-theme-child/data/disease-profiles.json",
      "accessed": "2026-10-31"
    },
    {
      "id": "src_profile_kidney_stone",
      "kind": "internal_profile",
      "title_fa": "شناسنامهٔ سنگ کلیه در مخزن",
      "publisher": "همیار جراحی — دادهٔ قالب",
      "ref": "themes/lax-theme-child/data/disease-profiles.json#kidney_stone",
      "url": "https://github.com/lakanzino/OR-site/blob/main/themes/lax-theme-child/data/disease-profiles.json",
      "accessed": "2026-10-31"
    },
    {
      "id": "src_profile_kidney_infection",
      "kind": "internal_profile",
      "title_fa": "شناسنامهٔ عفونت کلیه در مخزن",
      "publisher": "همیار جراحی — دادهٔ قالب",
      "ref": "themes/lax-theme-child/data/disease-profiles.json#kidney_infection",
      "url": "https://github.com/lakanzino/OR-site/blob/main/themes/lax-theme-child/data/disease-profiles.json",
      "accessed": "2026-10-31"
    },
    {
      "id": "src_profile_uti",
      "kind": "internal_profile",
      "title_fa": "شناسنامهٔ عفونت مجاری ادراری در مخزن",
      "publisher": "همیار جراحی — دادهٔ قالب",
      "ref": "themes/lax-theme-child/data/disease-profiles.json#urinary_tract",
      "url": "https://github.com/lakanzino/OR-site/blob/main/themes/lax-theme-child/data/disease-profiles.json",
      "accessed": "2026-10-31"
    },
    {
      "id": "src_profile_gastro",
      "kind": "internal_profile",
      "title_fa": "شناسنامهٔ التهاب معده و روده در مخزن",
      "publisher": "همیار جراحی — دادهٔ قالب",
      "ref": "themes/lax-theme-child/data/disease-profiles.json#gastroenteritis",
      "url": "https://github.com/lakanzino/OR-site/blob/main/themes/lax-theme-child/data/disease-profiles.json",
      "accessed": "2026-10-31"
    },
    {
      "id": "src_nhs_app",
      "kind": "clinical_guideline",
      "title_fa": "NHS — آپاندیسیت (نشانه‌ها و توصیهٔ مراجعهٔ فوری)",
      "publisher": "NHS",
      "url": "https://www.nhs.uk/conditions/appendicitis/",
      "accessed": "2026-10-31"
    },
    {
      "id": "src_niddk_stone",
      "kind": "clinical_guideline",
      "title_fa": "NIDDK — نشانه‌ها و علل سنگ کلیه",
      "publisher": "NIDDK (NIH)",
      "url": "https://www.niddk.nih.gov/health-information/urologic-diseases/kidney-stones/symptoms-causes",
      "accessed": "2026-10-31"
    },
    {
      "id": "src_nhs_uti",
      "kind": "clinical_guideline",
      "title_fa": "NHS — عفونت مجاری ادراری (UTI)",
      "publisher": "NHS",
      "url": "https://www.nhs.uk/conditions/urinary-tract-infections-utis/",
      "accessed": "2026-10-31"
    },
    {
      "id": "src_nhs_kidney_infection",
      "kind": "clinical_guideline",
      "title_fa": "NHS — عفونت کلیه",
      "publisher": "NHS",
      "url": "https://www.nhs.uk/conditions/kidney-infection/",
      "accessed": "2026-10-31"
    },
    {
      "id": "src_niddk_gastro",
      "kind": "clinical_guideline",
      "title_fa": "NIDDK — التهاب معده و روده (گاستروانتریت)",
      "publisher": "NIDDK (NIH)",
      "url": "https://www.niddk.nih.gov/health-information/digestive-diseases/gastroenteritis",
      "accessed": "2026-10-31"
    }
  ],
  "symptoms": [
    {
      "id": "abd.pain_abdomen",
      "legacy_id": "s_pain_abdomen",
      "cluster": "abd",
      "label_fa": "درد شکم",
      "synonyms": [
        "دل‌درد",
        "درد معده"
      ],
      "category": "pain"
    },
    {
      "id": "abd.pain_periumbilical_start",
      "legacy_id": "s_pain_periumbilical_start",
      "cluster": "abd",
      "label_fa": "شروع درد در اطراف ناف",
      "synonyms": [],
      "category": "pain"
    },
    {
      "id": "abd.pain_migrates_rlq",
      "legacy_id": "s_pain_migrates_rlq",
      "cluster": "abd",
      "label_fa": "حرکت درد به پایین سمت راست شکم",
      "synonyms": [],
      "category": "pain"
    },
    {
      "id": "abd.pain_rlq",
      "legacy_id": "s_pain_rlq",
      "cluster": "abd",
      "label_fa": "درد در پایین سمت راست شکم",
      "synonyms": [],
      "category": "pain"
    },
    {
      "id": "abd.pain_worse_movement",
      "legacy_id": "s_pain_worse_movement",
      "cluster": "abd",
      "label_fa": "بدترشدن درد با حرکت، راه‌رفتن یا سرفه",
      "synonyms": [],
      "category": "pain"
    },
    {
      "id": "abd.appetite_loss",
      "legacy_id": "s_appetite_loss",
      "cluster": "abd",
      "label_fa": "کم‌شدن اشتها",
      "synonyms": [
        "بی‌اشتهایی"
      ],
      "category": "general"
    },
    {
      "id": "abd.nausea",
      "legacy_id": "s_nausea",
      "cluster": "abd",
      "label_fa": "تهوع",
      "synonyms": [],
      "category": "gi"
    },
    {
      "id": "abd.vomiting",
      "legacy_id": "s_vomiting",
      "cluster": "abd",
      "label_fa": "استفراغ",
      "synonyms": [],
      "category": "gi"
    },
    {
      "id": "abd.fever",
      "legacy_id": "s_fever",
      "cluster": "abd",
      "label_fa": "تب یا احساس تب",
      "synonyms": [
        "تب‌لرز"
      ],
      "category": "general"
    },
    {
      "id": "abd.chills",
      "legacy_id": "s_chills",
      "cluster": "abd",
      "label_fa": "لرز",
      "synonyms": [],
      "category": "general"
    },
    {
      "id": "abd.constipation",
      "legacy_id": "s_constipation",
      "cluster": "abd",
      "label_fa": "یبوست",
      "synonyms": [],
      "category": "gi"
    },
    {
      "id": "abd.diarrhea",
      "legacy_id": "s_diarrhea",
      "cluster": "abd",
      "label_fa": "اسهال",
      "synonyms": [],
      "category": "gi"
    },
    {
      "id": "abd.bloating",
      "legacy_id": "s_bloating",
      "cluster": "abd",
      "label_fa": "نفخ شکم",
      "synonyms": [],
      "category": "gi"
    },
    {
      "id": "abd.no_gas_pass",
      "legacy_id": "s_no_gas_pass",
      "cluster": "abd",
      "label_fa": "ناتوانی در دفع گاز",
      "synonyms": [],
      "category": "gi"
    },
    {
      "id": "abd.flank_pain",
      "legacy_id": "s_flank_pain",
      "cluster": "abd",
      "label_fa": "درد پهلو یا کمر",
      "synonyms": [
        "درد ناحیهٔ کلیه"
      ],
      "category": "pain"
    },
    {
      "id": "abd.radiate_groin",
      "legacy_id": "s_radiate_groin",
      "cluster": "abd",
      "label_fa": "انتشار درد به کشالهٔ ران یا پایین شکم",
      "synonyms": [],
      "category": "pain"
    },
    {
      "id": "abd.colicky_pain",
      "legacy_id": "s_colicky_pain",
      "cluster": "abd",
      "label_fa": "درد موج‌وار (کم و زیاد می‌شود)",
      "synonyms": [],
      "category": "pain"
    },
    {
      "id": "abd.dysuria",
      "legacy_id": "s_dysuria",
      "cluster": "abd",
      "label_fa": "سوزش یا درد هنگام ادرار",
      "synonyms": [],
      "category": "urinary"
    },
    {
      "id": "abd.frequency",
      "legacy_id": "s_frequency",
      "cluster": "abd",
      "label_fa": "تکرر ادرار",
      "synonyms": [],
      "category": "urinary"
    },
    {
      "id": "abd.urgency",
      "legacy_id": "s_urgency",
      "cluster": "abd",
      "label_fa": "فوریت ادراری",
      "synonyms": [
        "فشار ناگهانی برای ادرار"
      ],
      "category": "urinary"
    },
    {
      "id": "abd.hematuria",
      "legacy_id": "s_hematuria",
      "cluster": "abd",
      "label_fa": "خون در ادرار یا ادرار صورتی/قرمز/قهوه‌ای",
      "synonyms": [],
      "category": "urinary"
    },
    {
      "id": "abd.cloudy_urine",
      "legacy_id": "s_cloudy_urine",
      "cluster": "abd",
      "label_fa": "ادرار کدر یا بدبو",
      "synonyms": [],
      "category": "urinary"
    },
    {
      "id": "abd.bladder_pressure",
      "legacy_id": "s_bladder_pressure",
      "cluster": "abd",
      "label_fa": "درد یا فشار ناحیهٔ مثانه",
      "synonyms": [],
      "category": "urinary"
    },
    {
      "id": "abd.abdominal_cramp",
      "legacy_id": "s_abdominal_cramp",
      "cluster": "abd",
      "label_fa": "درد یا گرفتگی شکم",
      "synonyms": [
        "کرامپ شکم"
      ],
      "category": "gi"
    },
    {
      "id": "abd.dehydration",
      "legacy_id": "s_dehydration",
      "cluster": "abd",
      "label_fa": "نشانه‌های کم‌آبی",
      "synonyms": [